66	42	1	TRUE	Neha	It was nice to see useful chat messages being organized without unrelated ones and keep them like memos	I was able to enjoy the stream by looking at the parts that people were mainly interested in.	Both equally similar	I could understand the flow of the game well because it made the order of previous events clear for me.	
39	43	1	FALSE	Neha	I think, in general, even with my team I just I started out with emojis and get pretty crazy and then I fgured out if the person and I had the kind of relationship that was casual enough for sharing because there’s defnitely GIFs that are like very funny funny like those are the kind that you will interact with a friend using	I ensured to use two smileys at least when emailing my team mates. It softens the tension that we have because we don’t know each other	Right more similar ->	I would say, for using, for using like a stickers and memes, they are, they are fun, but I don’t use use those with like, with like everyone, basically I use these GIFs and stickers approximately with only like four to fve people...but the people who I am like comfortable with, whom I chat like after ofce, if I share my personal things with them to, with those people, I’m pretty comfortable and I share the stickers and memes with them.	Y
100	44	1	TRUE	Neha	Typical live streams are unedited, so it’s easy to get bored when it gets loose. However, the summary feature made me enjoy the stream especially when the streamer was not speaking or something that I’m not interested in was being played	I could understand the flow of the game well because it made the order of previous events clear for me.	Both equally similar	Based on snapshots and keywords I was able to roughly understand when ingredients were introduced and when and what ingredients were added. However, it was difcult to grasp the exact contents with the highlight feature alone, such as how it was cooked	
74	45	1	TRUE	Neha	Most people, people in my team, are above 50 or 60, so it’s a little difcult to send like meme, stickers it can mean like something diferent if you are not sending to the people of your own age...Because I did not like I uh I did not get any response back, so I thought, okay, so maybe I should not have sent that; otherwise, she would have been responded to me...it’s a generational gap.	The very frst time, I couldn’t use all this because I was not aware Like if it was actually a good thing to do so, even with the manager, I still can’t do it... though things are smooth and all but I still can’t do it or use emoji while chatting with my manager or some other person in the senior management, it is just that we use simple SMILEY	Both equally similar	I would say, for using stickers and memes, they are fun, but I don’t use those with like everyone basically I use these GIFs and stickers approximately with only like four to fve people...I keep my professional distance...if you would say because nobody uses those I have back in India, so I am on the fence with that	
37	46	1	FALSE	Neha	I think that an issue that a lot of wheelchair users have with games, because obviously there aren’t many they seem a bit handholdy sort of alienated in a way, it feels very specifically designed for wheelchair users while someone in a wheelchair could use it, when it’s simple it seems obvious that it’s for someone in a wheelchair	[some games] are very obviously teaching you math	Both equally similar	game is there for me to escape and forget what I’m doing [...] it allows me not to be reminded of what I look like	
91	47	1	FALSE	Neha	The system let me know roughly what happened before, but some keywords were too general so it was hard to know what happened exactly	Based on snapshots and keywords I was able to roughly understand when ingredients were introduced and when and what ingredients were added. However, it was difcult to grasp the exact contents with the highlight feature alone, such as how it was cooked	Both equally similar	The transcript was awkwardly transcribed so it was hard to understand the content.	
129	48	1	FALSE	Neha	if the building has accessibility but it requires someone to operate the lift for you, you don’t feel very independent, you don’t want to feel as if people are going out of their way	One of the reasons I don’t play [movement-based games] is it involves a lot of set up depending on what game you want to play.	Neither is similar	muscles will cramp up making it impossible to return home	
64	49	1	FALSE	Neha	It was a long time ago, last year, when I uploaded a ftness video...Probably it happened to step on the recommendation algorithm, and it got over 500,000 views shortly, but it did not bring many followers...and the interaction was also not good.	For me to make the Vlog, frst it is to share my life, and second, I hope it can also help others.”	Neither is similar	Some fans told me in their private message that they got dates by following my tutorials...I felt it was worth it. Even if the video was only watched by a number of viewers, it was worth it. I was very happy. It was the highlight and gave me a sense of achievement.	
132	50	1	TRUE	Neha	it feels better to pull with a more guarantee at the back of your mind	[a pity system] encourages the player to keep going since they expect they will get something better	<- Left more similar	I’m not a huge fan of the system because they are optimized to make more money, they are designed so that if you don’t spend money your progress is a lot more limited. [Companies] have psychological tricks to make you spend more money	Y
13	51	1	TRUE	Neha	I can say, when I was not very familiar with the team, I was hesitant to use diferent smileys. Like you know, I’m kind of like shy in nature when it comes to like sharing a heart SMILEY with others. It is sometimes difcult for me, so yeah, I was frst like very hesitant to put a heart. But later as I get to know people, yeah they are like kind of cool... I don’t mind using it now	Yes, I would say that because previously in my last company I have made some great friends and, and I did not met with them like face to face ever, but I, but I still talk to them and I haven’t had any calls with them only messages and right now, at this company, I never had, I never had any physical Like physical connection with like a with like anyone [...] so I would say yes, non-textual responses have helped me in in building the relationships and I have made some great friends in my previous [and] current company	Right more similar ->	There is this thing within a certain group they have like a norm that they don’t use the praying emoji for thank you because they do not want to use any religious emoji...so they like own a thank you emoji and...when I entered, I didn’t know this, so I used the praying emoji for Thank you emoji, and then some people sent me a message saying I should use the other non-religious thank you emoji	Y
148	52	1	TRUE	Neha	you’re just hoping the items drop, you’re sort of wondering am I just unlucky or am I spending more time than I really should be doing this sort of thing	I defnitely prefer the deterministic one ... it defnitely just feels a little better to just know that you’ll be done once and for all if you do it in a deterministic way	<- Left more similar	A game where if you don’t pay money or put in a lot of time, you can’t play most of the game	Y
29	53	1	FALSE	Neha	I haven’t seen a lot of people using them already so you have to conform with or whatever is going on in the company right, I cannot be like Oh, you know I’m so friendly and everything and start using it	I actually mostly have that problem with the thumbs up analogy because, like, in my family like if I use that with my mom she would think I was really passive aggressive and like vice versa, my mom used that with me and actually the frst time, my supervisor used it, I thought she was mad at me, and then I realized that was her version	Right more similar ->	The very frst time, I couldn’t use all this because I was not aware Like if it was actually a good thing to do so, even with the manager, I still can’t do it... though things are smooth and all but I still can’t do it or use emoji while chatting with my manager or some other person in the senior management, it is just that we use simple SMILEY	N
69	54	1	TRUE	Neha	I’m not sure who’s signing, I’m not sure who’s talking	when there are more people in the room we can’t all fit in one screen and so you have to swipe screens to get the view of the other people and that is a signifcant problem	Both equally similar	I don’t know if they’ve raised their hand or where they are. Sometimes I can’t see them and it’ll be like, oh, they’re on a diferent screen	
109	55	1	TRUE	Neha	Yes, I would say that because previously in my last company I have made some great friends and, and I did not met with them like face to face ever, but I, but I still talk to them and I haven’t had any calls with them only messages and right now, at this company, I never had, I never had any physical Like physical connection with like a with like anyone [...] so I would say yes, non-textual responses have helped me in in building the relationships and I have made some great friends in my previous [and] current company	Then slowly, then, after some time we transcended from emails to phone calls and then to video calls like four ... And that happened because I would sometimes use SMILEY or some emoji and they would also reciprocate	<- Left more similar	I can say, when I was not very familiar with the team, I was hesitant to use diferent smileys. Like you know, I’m kind of like shy in nature when it comes to like sharing a heart SMILEY with others. It is sometimes difcult for me, so yeah, I was frst like very hesitant to put a heart. But later as I get to know people, yeah they are like kind of cool... I don’t mind using it now	N
71	56	1	FALSE	Neha	I’m very less familiar with these emojis infact till today also I don’t know the actual need of some emojis	It’s not professional, so when joining a new team, it seems inappropriate to use gifs/stickers when others do not. If I work with this team longer, I’m sure I will start using them once I know everyone well	Neither is similar	You don’t really know these people, and so you want to give of the right meaning of the message. Since we work remotely, what makes sense to you may not for them... especially since I was new, they did not know my personality	
118	57	1	FALSE	Neha	adding delay and baiting the colours of the rarity for the thrill	In Genshin Impact I feel I got something really good because I can see that it shows that I got something really good. whereas in [League of Legends] they feel all the same, . . . , so I don’t really care about the skin I get it’s all just whatever	Neither is similar	if I get something [not as good] I feel worse	
87	58	1	TRUE	Neha	The number of viewers soon reached over 10,000, and it was so much higher than what I imagined. I imagined it could be, could be tens of people to watch.	Some fans told me in their private message that they got dates by following my tutorials...I felt it was worth it. Even if the video was only watched by a number of viewers, it was worth it. I was very happy. It was the highlight and gave me a sense of achievement.	Neither is similar	I tried Douyin but gave it up. I was not used to that atmosphere...I’ve also synced my works to Weibo, and gave it up too. After I tried around...I still feel I like Bilibili’s atmosphere the most	
131	59	1	FALSE	Neha	interpreters usually will sign some signal to let me know that I need to look from one interpreter to the next	I have to kind of be quick on that because I don’t want to miss any of the information	<- Left more similar	scroll through a whole gallery page of postage stamp sized cameras to fnd interpreters	Y
36	60	1	TRUE	Neha	I think it’s pretty bad ... it’s not something that is super spectacular, or something that makes you feel really great and stuff	it’s just visually appealing to look at” (P8), and “you get a flash of light at the beginning, and you’re like oh ****, ... it’s really exciting you know	Both equally similar	Wow, this is the most boring opening I’ve ever seen. It feels like you’re doing homework, feels like you’re just clicking buttons. There’s no visual feedback or visual reward	
150	61	1	TRUE	Neha	“I will do something to enhance the video efects. For instance, I was there for Chinese osteopathy, so I would turn my head...exaggerate my emotional expressions, and so on	If sometimes I happened to experience something that is trafc related, I will do the trafc video, but if not, I will not make trafc videos deliberately.	Neither is similar	Actually I think it depends on everyone as an individual, because everyone has diferent situations. Some are suitable to do makeup videos, because they have mastered good makeup techniques...For uploaders like me, who have conversational type [of videos], it is important that we are engaging in a conversation. That is, when facing a camera, we act like we are engaging in a conversation with you. If you just recite the script, it will not be good...Um..I took hosting lessons when I was a child, so I am relatively good at it	
93	62	1	FALSE	Neha	The very frst time, I couldn’t use all this because I was not aware Like if it was actually a good thing to do so, even with the manager, I still can’t do it... though things are smooth and all but I still can’t do it or use emoji while chatting with my manager or some other person in the senior management, it is just that we use simple SMILEY	I haven’t seen a lot of people using them already so you have to conform with or whatever is going on in the company right, I cannot be like Oh, you know I’m so friendly and everything and start using it	Right more similar ->	Most people, people in my team, are above 50 or 60, so it’s a little difcult to send like meme, stickers it can mean like something diferent if you are not sending to the people of your own age...Because I did not like I uh I did not get any response back, so I thought, okay, so maybe I should not have sent that; otherwise, she would have been responded to me...it’s a generational gap.	Y
38	63	1	FALSE	Neha	I think you have to have a pity system or else I would get so mad in not getting the item forever that I would actually quit the game	[a pity system] encourages the player to keep going since they expect they will get something better	<- Left more similar	you’re just like praying it lands on a spot that is really good, it’s like oh, I was so close to getting this purple one	Y
4	64	1	FALSE	Neha	Based on snapshots and keywords I was able to roughly understand when ingredients were introduced and when and what ingredients were added. However, it was difcult to grasp the exact contents with the highlight feature alone, such as how it was cooked	The system let me know roughly what happened before, but some keywords were too general so it was hard to know what happened exactly	<- Left more similar	Typical live streams are unedited, so it’s easy to get bored when it gets loose. However, the summary feature made me enjoy the stream especially when the streamer was not speaking or something that I’m not interested in was being played	Y
83	65	1	FALSE	Neha	Sometimes the system don’t realize that you have perceived an issue and they will do something that you think is irresponsible..For example, you could have a collision avoidance system that is doing the best to avoid you running into a wall, but actually you are trying to get closer to the wall because you are trying to avoid a child running on the pavement	In the crowds, it is most likely the wheelchair will keep changing its direction to avoid people, which is the least thing I would want to have..It can be confusing and uncomfortable..	Right more similar ->	When the wheelchair does something out of my intention and that causes unhappiness for other people, I don’t want people to think it is what I intend to do and I’m a bad guy.	Y
117	66	1	FALSE	Neha	[some games] are very obviously teaching you math	I think that an issue that a lot of wheelchair users have with games, because obviously there aren’t many they seem a bit handholdy sort of alienated in a way, it feels very specifically designed for wheelchair users while someone in a wheelchair could use it, when it’s simple it seems obvious that it’s for someone in a wheelchair	<- Left more similar	they tell you to stand on your toes and slowly lower, you are bored out of your mind	Y
137	67	1	TRUE	Neha	muscles will cramp up making it impossible to return home	if the building has accessibility but it requires someone to operate the lift for you, you don’t feel very independent, you don’t want to feel as if people are going out of their way	Neither is similar	I used to do it all the time [be physically active], why should I stop now?	
67	68	1	TRUE	Neha	It’s not professional, so when joining a new team, it seems inappropriate to use gifs/stickers when others do not. If I work with this team longer, I’m sure I will start using them once I know everyone well	I’m very less familiar with these emojis infact till today also I don’t know the actual need of some emojis	Neither is similar	I use Microsoft teams which doesn’t support most of gifs	
23	69	1	TRUE	Neha	I feel that they help convey emotion and provide context in text conversations, where feelings are not as easily expressed as in video calls. After a while on the team, it was also a means of having a laugh or adding favor to casual conversations and getting to know one another. For messages with a wider audience, they served as a quick way to express agreement, looking into something or give a quick response to indicate that attention has been given to a message someone has put out	“To make the conversation a little lighter and to indicate if something is funny or hilarious	Both equally similar	It helps to communicate emotion and create more meaningful connections with your team. It gives the conversation a more human and connected feel	
107	70	1	FALSE	Neha	Yeah, I mean one thing is that there are too many emoji and I have to if I had to use a new one, I had to go and search what it means, and then use it. So most of the times, I’m aware that there is a hover over feature, it tells the meaning, but it’s just that there are too many. So, I think it’s just a preference that I tend to not look over it since, as I mean since I’m a Ph.D. student, I tend to have a short amount of time to get things done in a short amount of time	So he would say thank you over the video, and after a few minutes he would send a giphy...he would send that, and that sticker would be crying. And it would seem that that person is sad, and I wouldn’t say anything like for a few days, but then I noticed this kept happening again. I was totally clueless...and then it turns out that he was sending like over happiness, which I thought, like, ‘Why is he crying and why is the person sad?	Right more similar ->	When I want to search some like keywords, but I cannot get the emoji, I don’t know if they have, like several keywords for emoji or there’s just like a naming for the emoji say if you give one emoji several keywords I can search it very quickly... Sometimes when I type something, especially for the emoji. I cannot get the result. I can just see no results	N
5	71	1	FALSE	Neha	Because you will kick out uploaders. When you browse the new updates, and if you fnd that this uploader has not been making videos or making terrible ones recently, you will unfollow him,right?	If you do not have stable uploading, you will be given up	Both equally similar	You can see that once they were very productive, full of energy, updating weekly. As creators, it was like they were in their youth, and they were especially popular... And slowly you will fnd that the issues they want to talk about or the things they care about have all been covered... In a video, one uploader said, ‘I am done telling you all my opinions about fashion, and I don’t need to output more’... So I feel their updating is slowing down... It becomes more casual, nothing very purposeful or strong anymore	
78	72	1	FALSE	Neha	So he would say thank you over the video, and after a few minutes he would send a giphy...he would send that, and that sticker would be crying. And it would seem that that person is sad, and I wouldn’t say anything like for a few days, but then I noticed this kept happening again. I was totally clueless...and then it turns out that he was sending like over happiness, which I thought, like, ‘Why is he crying and why is the person sad?	I actually mostly have that problem with the thumbs up analogy because, like, in my family like if I use that with my mom she would think I was really passive aggressive and like vice versa, my mom used that with me and actually the frst time, my supervisor used it, I thought she was mad at me, and then I realized that was her version	<- Left more similar	Yeah, I mean one thing is that there are too many emoji and I have to if I had to use a new one, I had to go and search what it means, and then use it. So most of the times, I’m aware that there is a hover over feature, it tells the meaning, but it’s just that there are too many. So, I think it’s just a preference that I tend to not look over it since, as I mean since I’m a Ph.D. student, I tend to have a short amount of time to get things done in a short amount of time	N
97	73	1	TRUE	Neha	There is an emoji that’s kind of like that this guy used to send to everybody, and it became kind of like his thing...And then now do you know we don’t see that emoji thrown around anymore, and feel like people don’t want to use it, because then you know; it’s copycatting that guy	When I joined, someone told me we all had chosen a specifc emoji, and whenever we have a recommended message, oh, I’ve read it instead of like All responding separately. We respond with our personal emoji, so that’s a super formal way, my favorite emojis were already taken when I joined the group, so I chose, in the end, a fun video emoji with like a star...	<- Left more similar	My team lead posts some kind of random joke every day on like one the platform, so what he did was like he posts a joke there, and he would add random emoji at the bottom with the post, and would want us to vote using those emoji	Y
96	74	1	TRUE	Neha	There is a lot more information that a GIF carries compared to an emoji...it is just a fxed kind of expression or emotion devoid of any context of why, like a person is feeling that way, except for like what it is that you are talking about in the conversation	Young people in China use slightly smiling emoji when they do not care or are speechless, and you do not wish to engage...once a Prof. from China used and I had no idea what he means...I asked for clarifcation, suggestions to improve if something was not right	Neither is similar	I would say, for using, for using like a stickers and memes, they are, they are fun, but I don’t use use those with like, with like everyone, basically I use these GIFs and stickers approximately with only like four to fve people...but the people who I am like comfortable with, whom I chat like after ofce, if I share my personal things with them to, with those people, I’m pretty comfortable and I share the stickers and memes with them.	
144	75	1	TRUE	Neha	with this [Scavengers] you are doing the exercises because it is a fun thing to do. Also, the actions you are doing seem more relevant to what’s going on on the screen.	you don’t think about doing these activities when you’re playing the game like collecting these pizzas or fighting robots, so it becomes one more robot, one more robot, and you don’t even realise you’ve done PA	<- Left more similar	game is there for me to escape and forget what I’m doing [...] it allows me not to be reminded of what I look like	Y
70	76	1	FALSE	Neha	I’m pretty good at driving the wheelchair and perceive the available space...If I say go through that gap, the technology should be making sure that I’m going through that gap and doing the avoidance, but not slowing down to crawl.	Full autonomy will allow me to focus on other things. For example, say take me to platform H, it will take me automatically there while I can focus on chatting with my friend.	<- Left more similar	It is a superb design! Clearly, it would enable more people to drive, because it’s not excluding you on the basis of an inability to drive	N
143	77	1	TRUE	Neha	when you try to communicate a lot using a limited medium like a job is essentially an instant messenger that comes from the idea that you can’t really write letters and expect people to receive it and all of that right	There is this thing within a certain group they have like a norm that they don’t use the praying emoji for thank you because they do not want to use any religious emoji...so they like own a thank you emoji and...when I entered, I didn’t know this, so I used the praying emoji for Thank you emoji, and then some people sent me a message saying I should use the other non-religious thank you emoji	<- Left more similar	I would say, for using stickers and memes, they are fun, but I don’t use those with like everyone basically I use these GIFs and stickers approximately with only like four to fve people...I keep my professional distance...if you would say because nobody uses those I have back in India, so I am on the fence with that	Y
